messages,lead_info,behavioral_data,intent,conversion_score
"[{'role': 'user', 'content': 'Hi, I\\'m looking for a CRM solution for our sales team'}, {'role': 'assistant', 'content': 'Hello! I\\'d be happy to help you find the right CRM solution. Could you tell me a bit about your team size and current challenges?'}, {'role': 'user', 'content': 'We have about 25 sales reps and we\\'re currently using spreadsheets. It\\'s getting really difficult to track everything.'}, {'role': 'assistant', 'content': 'I understand the challenge with spreadsheets. What specific problems are you trying to solve with a CRM?'}, {'role': 'user', 'content': 'We need better lead tracking, pipeline management, and reporting. Our current process is too manual.'}, {'role': 'assistant', 'content': 'That makes sense. What\\'s your timeline for implementing a solution?'}, {'role': 'user', 'content': 'We need something within the next 2-3 months. Our current process is costing us deals.'}, {'role': 'assistant', 'content': 'I can help you with that timeline. What\\'s your budget range for this solution?'}, {'role': 'user', 'content': 'We have about $50,000 budgeted for this project.'}]","{'name': 'John Smith', 'company': 'TechStart Inc', 'role': 'Sales Director', 'industry': 'Technology', 'team_size': 25}","{'pages_visited': 5, 'trial_usage': 0.0, 'email_opens': 2, 'demo_requested': False}","buy_soon",85
"[{'role': 'user', 'content': 'Hello, I\\'m interested in learning more about your product'}, {'role': 'assistant', 'content': 'Hi! I\\'d be happy to tell you more about our solution. What brings you to us today?'}, {'role': 'user', 'content': 'I\\'m just doing some research for our company. We\\'re evaluating different options.'}, {'role': 'assistant', 'content': 'Great! What industry are you in and what problems are you trying to solve?'}, {'role': 'user', 'content': 'We\\'re in healthcare and we need better patient management. But we\\'re just starting to look at options.'}, {'role': 'assistant', 'content': 'I understand. What\\'s your timeline for making a decision?'}, {'role': 'user', 'content': 'Probably 6-12 months. We\\'re still in the early stages of planning.'}, {'role': 'assistant', 'content': 'That\\'s a good timeline. What\\'s your team size?'}, {'role': 'user', 'content': 'We have about 10 people in our department.'}]","{'name': 'Sarah Johnson', 'company': 'HealthCare Plus', 'role': 'Operations Manager', 'industry': 'Healthcare', 'team_size': 10}","{'pages_visited': 2, 'trial_usage': 0.0, 'email_opens': 1, 'demo_requested': False}","researching",35
"[{'role': 'user', 'content': 'Hi, I need pricing information for your CRM solution'}, {'role': 'assistant', 'content': 'Hello! I\\'d be happy to provide pricing information. To give you the most accurate quote, could you tell me about your team size?'}, {'role': 'user', 'content': 'We have 50 sales reps and we\\'re looking to replace Salesforce. It\\'s too expensive for us.'}, {'role': 'assistant', 'content': 'I understand the cost concern with Salesforce. What specific features do you need?'}, {'role': 'user', 'content': 'We need lead management, pipeline tracking, reporting, and email integration. We have a budget of $100,000 annually.'}, {'role': 'assistant', 'content': 'That budget should work well for your needs. What\\'s your timeline for implementation?'}, {'role': 'user', 'content': 'We need to make a decision within the next month and implement within 3 months.'}, {'role': 'assistant', 'content': 'That timeline is very doable. Would you like to schedule a demo to see the features in action?'}, {'role': 'user', 'content': 'Yes, that would be great. I\\'m the VP of Sales and I can make the final decision.'}]","{'name': 'Mike Davis', 'company': 'Enterprise Solutions', 'role': 'VP of Sales', 'industry': 'Technology', 'team_size': 50}","{'pages_visited': 8, 'trial_usage': 0.3, 'email_opens': 5, 'demo_requested': True}","buy_soon",90
"[{'role': 'user', 'content': 'Hello, I saw your ad on LinkedIn. Can you tell me more about your product?'}, {'role': 'assistant', 'content': 'Hi! Thanks for your interest. What caught your attention about our solution?'}, {'role': 'user', 'content': 'We\\'re looking for a better way to manage our leads. We\\'re a small startup with 5 sales people.'}, {'role': 'assistant', 'content': 'Perfect! What industry are you in and what challenges are you facing?'}, {'role': 'user', 'content': 'We\\'re in SaaS and we\\'re growing fast. Our current process is too manual and we\\'re missing opportunities.'}, {'role': 'assistant', 'content': 'I understand the challenge. What\\'s your budget range for a solution?'}, {'role': 'user', 'content': 'We\\'re looking at $5,000-$10,000 annually. We need something affordable but effective.'}, {'role': 'assistant', 'content': 'That budget should work well. What\\'s your timeline for making a decision?'}, {'role': 'user', 'content': 'We need something within the next 2 months. We\\'re losing deals because of our current process.'}]","{'name': 'Lisa Chen', 'company': 'StartupXYZ', 'role': 'Founder', 'industry': 'SaaS', 'team_size': 5}","{'pages_visited': 4, 'trial_usage': 0.1, 'email_opens': 3, 'demo_requested': False}","buy_soon",75
"[{'role': 'user', 'content': 'Hi, I\\'m just browsing and wanted to learn more about your product'}, {'role': 'assistant', 'content': 'Hello! I\\'d be happy to tell you more. What brings you to our website today?'}, {'role': 'user', 'content': 'I\\'m a student doing research for a project. I\\'m not actually looking to buy anything.'}, {'role': 'assistant', 'content': 'I understand! What kind of project are you working on?'}, {'role': 'user', 'content': 'I\\'m studying business and comparing different CRM solutions. This is just academic research.'}, {'role': 'assistant', 'content': 'That\\'s great! What aspects of CRM solutions are you focusing on for your project?'}, {'role': 'user', 'content': 'I\\'m looking at pricing models, features, and target markets. Just gathering information.'}, {'role': 'assistant', 'content': 'I can help with that. What specific questions do you have about our solution?'}, {'role': 'user', 'content': 'Just general information about features and pricing. Nothing specific.'}]","{'name': 'Alex Wilson', 'company': 'University', 'role': 'Student', 'industry': 'Education', 'team_size': 1}","{'pages_visited': 1, 'trial_usage': 0.0, 'email_opens': 0, 'demo_requested': False}","not_interested",10
"[{'role': 'user', 'content': 'Hello, I\\'m interested in your CRM solution for our company'}, {'role': 'assistant', 'content': 'Hi! I\\'d be happy to help. What company are you with and what brings you to us?'}, {'role': 'user', 'content': 'I work for a manufacturing company with about 100 employees. We need better customer management.'}, {'role': 'assistant', 'content': 'I understand. What specific challenges are you facing with customer management?'}, {'role': 'user', 'content': 'We\\'re using Excel spreadsheets and it\\'s getting unmanageable. We need something more robust.'}, {'role': 'assistant', 'content': 'That\\'s a common challenge. What\\'s your timeline for implementing a solution?'}, {'role': 'user', 'content': 'We\\'re planning for next year. We want to do this right and take our time.'}, {'role': 'assistant', 'content': 'That\\'s a good approach. What\\'s your budget range?'}, {'role': 'user', 'content': 'We haven\\'t set a budget yet. We\\'re still in the research phase.'}]","{'name': 'Robert Brown', 'company': 'Manufacturing Corp', 'role': 'IT Manager', 'industry': 'Manufacturing', 'team_size': 100}","{'pages_visited': 3, 'trial_usage': 0.0, 'email_opens': 1, 'demo_requested': False}","researching",45
"[{'role': 'user', 'content': 'Hi, I need a demo of your product ASAP. We\\'re evaluating solutions this week.'}, {'role': 'assistant', 'content': 'Hello! I can help you with a demo. What company are you with and what\\'s your role?'}, {'role': 'user', 'content': 'I\\'m the CEO of a fintech startup with 15 employees. We need a CRM immediately.'}, {'role': 'assistant', 'content': 'I understand the urgency. What specific problems are you trying to solve?'}, {'role': 'user', 'content': 'We\\'re losing deals because we can\\'t track our pipeline properly. We need something that works right away.'}, {'role': 'assistant', 'content': 'I can help with that. What\\'s your budget for this solution?'}, {'role': 'user', 'content': 'We have $20,000 budgeted and we need to implement within 2 weeks.'}, {'role': 'assistant', 'content': 'That timeline is very aggressive but doable. Can you tell me about your current process?'}, {'role': 'user', 'content': 'We\\'re using Google Sheets and it\\'s a disaster. We need something professional immediately.'}]","{'name': 'Jennifer Lee', 'company': 'FinTech Startup', 'role': 'CEO', 'industry': 'Financial Services', 'team_size': 15}","{'pages_visited': 6, 'trial_usage': 0.5, 'email_opens': 4, 'demo_requested': True}","buy_soon",95
"[{'role': 'user', 'content': 'Hello, I saw your product mentioned in an article. Can you tell me more?'}, {'role': 'assistant', 'content': 'Hi! Thanks for your interest. What article did you see us mentioned in?'}, {'role': 'user', 'content': 'It was a comparison of CRM solutions. I\\'m just doing some research for our company.'}, {'role': 'assistant', 'content': 'Great! What company are you with and what challenges are you facing?'}, {'role': 'user', 'content': 'We\\'re a consulting firm with 20 people. We need better client management.'}, {'role': 'assistant', 'content': 'I understand. What specific problems are you trying to solve?'}, {'role': 'user', 'content': 'We\\'re using multiple tools and it\\'s getting confusing. We need something integrated.'}, {'role': 'assistant', 'content': 'That\\'s a common challenge. What\\'s your timeline for making a decision?'}, {'role': 'user', 'content': 'Probably 3-6 months. We want to evaluate all our options carefully.'}]","{'name': 'David Miller', 'company': 'Consulting Partners', 'role': 'Managing Partner', 'industry': 'Consulting', 'team_size': 20}","{'pages_visited': 2, 'trial_usage': 0.0, 'email_opens': 1, 'demo_requested': False}","considering",60
"[{'role': 'user', 'content': 'Hi, I\\'m looking for pricing information'}, {'role': 'assistant', 'content': 'Hello! I\\'d be happy to provide pricing information. What company are you with?'}, {'role': 'user', 'content': 'I work for a retail company with 200 employees. We need a CRM for our sales team.'}, {'role': 'assistant', 'content': 'I understand. What specific challenges are you facing?'}, {'role': 'user', 'content': 'We\\'re using an old system that\\'s not working well. We need something modern and user-friendly.'}, {'role': 'assistant', 'content': 'I can help with that. What\\'s your budget range?'}, {'role': 'user', 'content': 'We have about $75,000 budgeted for this project.'}, {'role': 'assistant', 'content': 'That budget should work well. What\\'s your timeline?'}, {'role': 'user', 'content': 'We need to make a decision within the next month and implement within 6 months.'}]","{'name': 'Amanda Garcia', 'company': 'Retail Solutions', 'role': 'Sales Manager', 'industry': 'Retail', 'team_size': 200}","{'pages_visited': 7, 'trial_usage': 0.2, 'email_opens': 6, 'demo_requested': False}","considering",70
"[{'role': 'user', 'content': 'Hello, I\\'m just curious about your product. Not really looking to buy anything.'}, {'role': 'assistant', 'content': 'Hi! No problem at all. What caught your interest about our solution?'}, {'role': 'user', 'content': 'I just saw an ad and wanted to see what it was about. I\\'m not in the market for anything.'}, {'role': 'assistant', 'content': 'I understand! What industry are you in?'}, {'role': 'user', 'content': 'I\\'m in marketing but I\\'m not responsible for buying software. Just browsing.'}, {'role': 'assistant', 'content': 'Got it! What aspects of our solution interest you?'}, {'role': 'user', 'content': 'Just the AI features sound interesting. But we\\'re not looking to change anything right now.'}, {'role': 'assistant', 'content': 'I understand. If you have any questions about our AI capabilities, I\\'m happy to explain.'}, {'role': 'user', 'content': 'Thanks, but I\\'m just browsing. Not really interested in buying.'}]","{'name': 'Tom Anderson', 'company': 'Marketing Agency', 'role': 'Marketing Specialist', 'industry': 'Marketing', 'team_size': 5}","{'pages_visited': 1, 'trial_usage': 0.0, 'email_opens': 0, 'demo_requested': False}","not_interested",15
